link,Year,Event,Speaker,Organization,About ,Summary,Source of Summary,Topic 1,Sub-topic 1-1,Sub-topic 1-2,Sub-topic 1-3,Topic 2,Sub-topic 2-1,Sub-topic 2-2,Sub-topic 2-3
https://www.youtube.com/watch?v=uI6sCJPc_aY&list=PLJ506hQ4g3TiJnL5_UFtRgDFcEV9QNdd1&index=23,2022,NICE,Paul Haider,University of Bern,Latent equilibrium: A unified learning theory for arbitrarily fast computation with arbitrarily slow neurons,"The speaker, Paul Haider, is a PhD student in the newer TMA group at the University of Bern. He is presenting on ""latent equilibrium,"" which is a unifying framework for arbitrarily fast computation and learning with arbitrarily slow neurons. The talk is about efficient information processing in dynamical physical systems, such as the human brain. One of the key challenges is understanding learning in such systems, which can be translated to the credit assignment problem. In the case of artificial neural networks, this is done with the backpropagation algorithm, but since this algorithm is not biologically plausible, there are a lot of bioplausible approximations, such as equilibrium propagation, the segregated dendrites model, and the dendritic cortical micro circuits. However, the speaker argues that all of these models have a common problem, which is that their speed of information processing is limited by the speed of their components, which for neural networks are the neurons themselves. The talk also covers how this slowness affects the dynamics of networks and learning in these systems.",ChatGPT,Neuromorphic algorithms,Learning in SNNs,,,,,,
https://www.youtube.com/watch?v=uX-BiOOQC8E&list=PLJ506hQ4g3TiJnL5_UFtRgDFcEV9QNdd1&index=24,2022,NICE,Pau Vilimelis Aceituno,ETH Zurich,Information theory limits of neuromorphic energy efficiency,"The speaker is discussing how to use information theory and energy efficiency to design neuromorphic systems, which are efficient in some specific problems. They mention that the systems are heterogeneous and it can be difficult to know how efficient they can be or how to design them. The speaker references Shannon's theorems, which state that the right language for information is to use symbols and probabilities and that reliable communication or computation can work even if there is noise on the hardware. The speaker is proposing a new approach to Shannon's theorems by considering costs that are not symmetric and using a combinatorial view to encode symbols with the fewest number of neurons and active neurons to minimize costs. They also mention that this approach is similar to a classical paper on neural computation, but instead of trying to infer efficiency values, they are trying to think of it as a design problem.",ChatGPT,Neuromorphic algorithms,Symbolic computing,,,,,,
https://www.youtube.com/watch?v=6eNIMr_u61o&list=PLJ506hQ4g3TiJnL5_UFtRgDFcEV9QNdd1&index=25,2022,NICE,Johannes Leugering,Fraunhofer-Gesellschaft,Modeling and analyzing neuromorphic SNNs as discrete event systems,"The speaker, Johannes Leugering, is discussing a hobby project he is working on related to the simulation of spiking neural networks (SNNs) and discrete Event Systems. He explains that while detailed biophysical models of neurons, such as the Hodgkin-Huxley model, are good at capturing the biological properties of neurons, they are difficult to simulate on a large scale and it can be difficult to understand how they solve problems. He notes that many in the field of neuromorphic computing and SNNs have moved to simpler neural models, such as the leaky integrate-and-fire neuron model, which retain important features of the biological models but are simpler to simulate. He expresses that a drawback of this approach is that it is difficult to explain how these networks actually do computation, with the most common mental model being the concept of function approximation. He is interested in describing computation in an event-driven way, and is motivated by the idea that neurons may primarily perform coincidence detection, which can be captured by simpler models such as finite state machines or Petri nets.",ChatGPT,Neuromorphic algorithms,Computational Neuroscience,,,Neuromorphic circuits,Spiking neural networks,,
https://www.youtube.com/watch?v=GJKZruFuYw0&list=PLJ506hQ4g3TiJnL5_UFtRgDFcEV9QNdd1&index=26,2022,NICE,Catherine Schuman,University of Tennessee,A framework to enable top-down co-design of neuromorphic systems for real-world applications,"The speaker is discussing a framework for top-down co-design of neuromorphic systems for real-world applications. The framework, developed by the speaker's research group at the University of Tennessee, aims to bridge the disconnect between ongoing research efforts in neuromorphic hardware and the needs of applications and algorithms in the neuromorphic computing space. The framework includes a library of input and output coding approaches and common interfaces to back-end neuromorphic processors, as well as simulation frameworks for architecture assessment. The speaker's group also uses FPGA platforms and in-house built simulators to evaluate different neuromorphic hardware designs. The goal is to make it easier to understand how neuromorphic hardware can be useful in different applications and to help researchers easily extend the framework to support new neuromorphic hardware efforts.",ChatGPT,Neuromorphic circuits,Emerging hardware approaches for optimization,Network topology,Spiking neural networks,Neuromorphic algorithms,Evolutionary optimization,,
https://www.youtube.com/watch?v=1IqtUg-8rcc&list=PLJ506hQ4g3TiJnL5_UFtRgDFcEV9QNdd1&index=27,2022,NICE,Felix Wang,Sandia National Laboratories,Localization through grid-based encodings on digital elevation models,"The speaker, Felix Wang, is presenting a neuro-inspired localization algorithm that he has been developing in collaboration with colleagues at Sandia National Labs. The problem they are addressing is sensor-based localization, which is the process of determining an agent's position based on sensor input. They are implementing a distributed algorithm based on neuro-inspired models of grid cells and are applying it to a navigation-based dataset, specifically digital elevation models. They have adapted the grid-based representations to an abstract computational model and have refined it by aggregating the grid cells into modules that share the same spatial scale and orientation. They have also highlighted that using this distributed phase code representation has nice properties such as robustness to coding noise and the ability to represent thousands of distinct grid modules.",ChatGPT,Applications,Robotics,Collaborative autonomous systems,,,,,
https://www.youtube.com/watch?v=_PNlb126vdU&list=PLJ506hQ4g3TiJnL5_UFtRgDFcEV9QNdd1&index=28,2022,NICE,Craig Vineyard,Sandia National Laboratories,Neural mini-apps as a tool for neuromorphic computing insight,"The speaker is discussing the challenges of identifying a ""neuromorphic advantage"" in the context of benchmarking for novel spiking algorithms, and how traditional benchmarks are defined by the processing to be executed or the data set and task. They argue that this flexibility makes direct comparisons difficult, and that many data-driven machine learning benchmarks fall short in their ability to convey merit for ongoing comparisons. The goal is not to create yet another benchmark, but to advance the field and gain understanding of how to make benchmarks more useful for ongoing comparisons.",ChatGPT,Tools and datasets,Benchmark,,,,,,
https://www.youtube.com/watch?v=UM1mhq1bdY4&list=PLJ506hQ4g3TiJnL5_UFtRgDFcEV9QNdd1&index=29,2022,NICE,Eric Muller,Heidelberg University,Hands on tutorial BrainScaleS 2: Introduction,"BrainScaleS 2 is a neomorphic system, which means it uses analog circuits to model neuron behavior in a physical model. The system is an infrastructure project and is designed to support a variety of use cases. The hardware includes a simplified neural model, short-term plasticity, structured neurons, accelerated model dynamics, and programmable plasticity. The system has multiple types including a lab setup and an embedded system, with the latter being designed for mobile operation. The BrainScaleS 2 tutorial video is an introduction to the software and hardware of the system, as well as information on how to access and use the system.",ChatGPT,Tools and datasets,Computing platform,Tutorial,,Neuromorphic circuits,Large scale neuromorphic computing platform,,
https://www.youtube.com/watch?v=907zRDofz7Y&list=PLJ506hQ4g3TiJnL5_UFtRgDFcEV9QNdd1&index=30,2022,NICE,Jacob Kaiser,Heidelberg University,"Hands on tutorial BrainScaleS 2: Structured Neurons
    ","The video is a tutorial on using the BrainScaleS 2 system to create neural morphologies using structured neurons. The tutorial focuses on creating a simple chain of compartments using the system's ability to connect several neuron circuits and make use of the capabilities of each neuron circuit, such as passive properties like PSP propagation and active properties like dendritic spikes. The tutorial also covers how to establish connections between the different circuits, such as horizontal connections and a shared line, and how to form various neuromorphologies. The tutorial also shows how to use the system to perform an experiment where a synaptic input is injected into one compartment and the resulting PSP is recorded in different compartments, and how to plot the results.",ChatGPT,Tools and datasets,Computing platform,Tutorial,,Neuromorphic circuits,Large scale neuromorphic computing platform,,
https://www.youtube.com/watch?v=TkkIR7zhwMI&list=PLJ506hQ4g3TiJnL5_UFtRgDFcEV9QNdd1&index=31,2022,NICE,Andrew Rowley,University of Manchester,Hands on tutorial SpiNNaker,"The speaker is going through a tutorial on using the SpiNNaker system, which is a computer architecture designed for running simulations of neural networks. They explain how to access the system using the link provided by Bjorn, which leads to a co-laboratory interface where users can access the system and run simulations using the Pine programming language. The speaker also mentions that there is an older URL for accessing the system directly, but the co-laboratory is the recommended way of accessing it. They also mention that the system uses the Jupiter lab interface, and that it has the Spinnaker and Spinnaker kernels installed, which are based on Python 3. They also mention that there is a work folder that can be used to store files permanently, and that the system is generally not reset without the user's request.",ChatGPT,Neuromorphic circuits,Large scale neuromorphic computing platform,,,Tools and datasets,Computing platform,Tutorial,
https://www.youtube.com/watch?v=-dl1FPrpw1A&list=PLJ506hQ4g3TgOgbEDhZhbkPcTMdtNHmy-&index=1,2021,NICE,Mike Davies,Intel ,Lessons from Loihi for the future of neuromorphic computing,"The speaker, Mike Davies, is giving an update on the progress of the Loihi program at Intel, which is focused on creating intelligent, adaptive, and agile drones. He notes that the field of drone racing has advanced quickly in recent years, but that there is still a large gap in capabilities between what is currently possible with autonomous drones and what is possible with even the simplest animal brains, such as a parrot. The speaker suggests that by emulating the efficiency and speed of these simple brains, it may be possible to create drones that are much more capable and efficient than what is currently possible.",ChatGPT,Neuromorphic circuits,ASICs,,,,,,
https://www.youtube.com/watch?v=5UBbCNQW_7c&list=PLJ506hQ4g3TgOgbEDhZhbkPcTMdtNHmy-&index=2,2021,NICE,Ryad Benosman,UPITT,Why is neuromorphic event-based engineering the future of AI?,"The speaker, Ryad Benosman, is discussing the field of neuromorphic processing and why it is considered to be the future of AI. He references a group of people who began thinking about alternative forms of processing in the 1990s, and how advancements in sensors and processors have led to the current interest in neuromorphic processing from big technology companies. He argues the overwhelming amount of data being produced, is not sustainable and that neuromorphic processing offers a solution with its low power and low latency capabilities. The speaker also mentions that traditional methods of using CPUs or GPUs to process data from event-based cameras is not the most efficient way to handle the data, and that neuromorphic processing offers a better solution.",ChatGPT,Generic Introduction,,,,,,,
https://www.youtube.com/watch?v=y4OJLJYCmGU&list=PLJ506hQ4g3TgOgbEDhZhbkPcTMdtNHmy-&index=3,2021,NICE,Johannes Schemmel,Heidelberg University,Exploring the possibilities of analog neuromorphic computing with BrainScales,"It appears that the speaker is discussing the possibilities and advancements in computing technology, specifically in regards to energy consumption and performance. They mention specific companies such as Google and Tesla, and mention the importance of understanding logical information processing and future computing based on what is currently being learned. They also mention the use of specific technologies such as GPU's from Nvidia and IBM Datacenter. It also mentions some other areas such as green electronics systems, quantum computing, and machine learning. The overall theme is improving efficiency and performance of computing technology through advancements in research and development.",ChatGPT,Neuromorphic circuits,Large scale neuromorphic computing platform,Analog computing,,,,,
https://www.youtube.com/watch?v=iRVo08j7sDM&list=PLJ506hQ4g3TgOgbEDhZhbkPcTMdtNHmy-&index=4,2021,NICE,Sebastian Schmitt,Heidelberg University,BrainScaleS-1 From clean room to machine room,"The speaker is discussing the development and use of physical modeling of analog neuron circuits for building neuromorphic systems in Heidelberg. The approach uses dedicated circuits in every neuron to mimic the functions of biological neurons, and results in accelerated dynamics compared to real-time biology. They also mention the use of wafer scale integration to connect multiple chips together to emulate larger neural networks, and the use of a brain scales wafer module to house the wafer, distribute power, and handle input and output communication. The speaker also mentions the steps taken to assemble and test these systems, including optical inspection of the wafer.",ChatGPT,Neuromorphic circuits,Large scale neuromorphic computing platform,Analog computing,,,,,
https://www.youtube.com/watch?v=hVu6Hi7Dktk&list=PLJ506hQ4g3TgOgbEDhZhbkPcTMdtNHmy-&index=5,2021,NICE,Korbinian Schreiber,Heidelberg University,Closed-loop experiments on BrainScales-2,"The speaker is discussing the BrainScales2 platform, which is a chip that contains a hybrid architecture of an analog or mixed signal neural network core and a digital CPU. The chip has a high configurability and can be used for a variety of experiments and code implementation. The speaker also mentions that the BrainScales2 chip has a speed-up factor of 1000, which presents both advantages and challenges for researchers studying phenomena such as developmental processes in brains. The faster time-scales can greatly improve experiment throughput, but they can also be harder to handle.",ChatGPT,Neuromorphic circuits,Large scale neuromorphic computing platform,Analog computing,,,,,
https://www.youtube.com/watch?v=RtYahwyless&list=PLJ506hQ4g3TgOgbEDhZhbkPcTMdtNHmy-&index=6,2021,NICE,Jonathan Tapson,University of Technology Sydney,Batch << 1: Why neuromorphic computing architectures suit real-time workloads,"In his talk, Jonathan Tapson, the former Chief Science Officer of Gray Matter Labs, discusses the lessons learned from building a neuromorphic architecture for commercial real-time computing. He argues that neuromorphic architectures are suitable for a particular kind of machine learning and that the focus should be on specific domains in which they excel, rather than claiming more general advantages. He also emphasizes the importance of considering the specific workloads that the architecture will be used for, as edge workloads involve real-time decision-making and are different from cloud workloads. He points out that the appropriate architecture for processing uncorrelated data is different from that for processing highly correlated data.",ChatGPT,Generic Introduction,Uncategorized,,,,,,
https://www.youtube.com/watch?v=u5kLjflMslY&list=PLJ506hQ4g3TgOgbEDhZhbkPcTMdtNHmy-&index=7,2021,NICE,Thomas Pfeil,Bosch center for AI,Neuromorphic and AI research at BCAI,"Thomas Pfeil is a researcher at the Bosch Center for Artificial Intelligence, which is mainly located in Renningen, Germany. He is discussing research related to neuromorphic computing and the publicly funded project ulpec. Bosch is a large company with 400,000 employees and focuses on mobility solutions, with machine learning being a major area of research for the company. Thomas mentions that Bosch is participating in the ulpec project, which is about creating a smart microsystem that interconnects an event-based camera with a spiking neural network. The goal of this project is to develop low power, low latency, and event-driven systems. Thomas mentions some of the challenges in this field, including training large-scale networks and finding appropriate data sets.",ChatGPT,Generic Introduction,Uncategorized,,,,,,
https://www.youtube.com/watch?v=fjG_0zKGVfw&list=PLJ506hQ4g3TgOgbEDhZhbkPcTMdtNHmy-&index=8,2021,NICE,Florian Kelber,TU Dresden,Mapping deep neural networks on SpiNNaker2,"In this video, the speaker, Florian Kelber, presents his work as a PhD student at the Technical University of Dresden, where he has adapted the Spinnaker 2 architecture to improve performance for non-spiking neural networks. He also explains how specific models have been mapped onto the Spinnaker 2 architecture, and how the team is trying to maximize performance and energy efficiency by including an accelerator for matrix multiplication and deconvolution. The Spinnaker 2 chip is set to be released in the next one and a half to two months, with plans to build a 5 million core machine in 2022. Overall, the focus is on creating hybrid neural networks architectures and improve the performance for the specific tasks.",ChatGPT,Neuromorphic circuits,Large scale neuromorphic computing platform,,,,,,
https://www.youtube.com/watch?v=t53zEJLs39U&list=PLJ506hQ4g3TgOgbEDhZhbkPcTMdtNHmy-&index=9,2021,NICE,Jeff Hawkins,Numenta,From brains to silicon: Applying lessons from neuroscience to machine learning,"In this video, the speaker is discussing the work of their company, Numenta, which aims to reverse engineer the neocortex and apply what they learn to AI and machine learning. The speaker explains that the neocortex is responsible for all forms of intelligence, including high-level sensory perception, motor behaviors, language, and abstract thoughts. They also mention that the neocortex has the ability to continuously learn and that the basic unit of computation in the neocortex is the cortical column, which is a complete modeling system that works on implementing a type of reference frame. They also explain that the neocortex creates a model of the world in our heads, allowing us to infer our current situation and generate goal-oriented behavior.",ChatGPT,Neuromorphic algorithms,Computational Neuroscience,,,,,,
https://www.youtube.com/watch?v=BnRpZNuXgME&list=PLJ506hQ4g3TgOgbEDhZhbkPcTMdtNHmy-&index=10,2021,NICE,Brad Aimone,Sandia National Laboratories,A neuromorphic future for classical computing tasks,"The speaker is discussing neuromorphic computing and its potential impact on the broader computing world. They mention the concept of quantum computing, which has a clear benchmark for success called ""quantum supremacy"" that demonstrates its superiority over traditional computers. However, neuromorphic computing currently lacks a concrete benchmark for success, and the speaker proposes the idea of ""neuromorphic advantage"" as a way to measure the potential of the technology. This would involve identifying algorithms that are already advantageous on one axis (such as time or energy efficiency) and have strong scaling implications for the other axis. The speaker also mentions that they are focusing on current neuromorphic platforms such as the BrainScaleS and SpiNNaker systems, and comparing them to GPUs. They also note that future technologies such as analog and crossbar architectures will also be important to consider in the future.",ChatGPT,Generic Introduction,Uncategorized,,,Tools and datasets,Benchmark,,
https://www.youtube.com/watch?v=7yYfoLZA5Os&list=PLJ506hQ4g3TgOgbEDhZhbkPcTMdtNHmy-&index=11,2021,NICE,Christoph Ostrau,Bielefeld University,Benchmarking of neuromorphic hardware systems,"The speaker is a PhD student from Beatlefield University, and the talk is about benchmarking new morphic hardware systems. The main question guiding their research is how to compare the performance and efficiency of diverse systems. They have developed a ""black box"" approach, called the Neomorphic Benchmark Approach, which takes the user's perspective and has a high-level description of a spiking neural network that is mapped by an abstraction layer to various target systems. This allows for direct cross-platform networks and a back-end independent implementation. However, due to the large variety of systems, they have to open the black box a bit to allow platform-dependent configuration of these benchmarks. The framework they are using is called Snapseed, and they are comparing modern CPU and GPU implementations to older technology used in the spinning cast by Game Brainscape Systems. They have different levels of benchmarks, starting with low-level characterization benchmarks and ending with full applications, to be representative of the field.",ChatGPT,Uncategorized,Uncategorized,,,,,,
https://www.youtube.com/watch?v=KyFZKDT9uK8&list=PLJ506hQ4g3TgOgbEDhZhbkPcTMdtNHmy-&index=12,2021,NICE,Andrew Sornborger,Los Alamos National Lab.,Implementing backpropagation for learning on neuromorphic spiking hardware,"Andrew Sornborger, from Los Alamos National Laboratory, and his team have developed a method for implementing backpropagation, a widely-used algorithm for training neural networks, on neuromorphic spiking hardware. They were able to train a three-layer network to classify digits from the MNIST dataset, achieving a validation accuracy of 92% and a throughput of 1000 frames per second. Additionally, the energy consumption per sample was 0.3 millijoules, and the energy delay product was 0.3 microjoule-seconds.",ChatGPT,Uncategorized,Uncategorized,,,,,,
https://www.youtube.com/watch?v=4Hhn7GioCMo&list=PLJ506hQ4g3TgOgbEDhZhbkPcTMdtNHmy-&index=13,2021,NICE,Fabian Sinz,University Gottingen,Inductive bias transfer between brains and machines,"The speaker, Fabian Sinz, is the head of the Neural Intelligence Group at the University of Tübingen and is moving to the University of Göttingen this summer. He is interested in understanding why biological neurons are so much better at certain tasks than current state-of-the-art machine learning algorithms. He discusses the success of deep learning in the last 10 years, specifically in computer vision, but notes that these algorithms are brittle and do not generalize well beyond the statistics of their training set. He uses the example of adversarial examples, where small, invisible perturbations can completely throw off a classifier's decision, and notes that this shows that these classifiers use different decision strategies compared to humans. He also discusses a study by Robert Garros that shows the robustness of humans compared to classifiers in the face of image distortion.",ChatGPT,Uncategorized,Uncategorized,,,,,,
https://www.youtube.com/watch?v=pKNN93mNuc0&list=PLJ506hQ4g3TgOgbEDhZhbkPcTMdtNHmy-&index=14,2021,NICE,Pau Aceituno,ETH Zurich,STDP leads to efficient coding of predictions,"The speaker is discussing research they did during their PhD at the Max Planck Institute for Mathematics and the Sciences. The talk is focused on computational neuroscience and the idea that learning is not just about adjusting weights, but also how the timing of spikes changes as an individual becomes more familiar with a certain input. They mention the concept of latency reduction, in which a postsynaptic spike advances in time as a neuron learns. They also mention some technical considerations, such as making sure depression is slightly larger than potentiation to prevent instability, and the potential for one postsynaptic spike to be weaker than another if they get too close together in time. The speaker also mentions the study of triplet rules as related to their research.",ChatGPT,Uncategorized,Uncategorized,,,,,,
https://www.youtube.com/watch?v=gYMRy8ptbKk&list=PLJ506hQ4g3TgOgbEDhZhbkPcTMdtNHmy-&index=15,2021,NICE,Andreas Wild,Intel,Intel Loihi's NxSDK: Introduction and overview,-,,Uncategorized,Uncategorized,,,,,,
